MZ334504.1_orf1620	290f29a5d87dbd6961b38ba6c8c7cede	1304	Gene3D	G3DSA:3.40.50.150	Vaccinia Virus protein VP39	640	835	2.6E-28	T	24-06-2023	IPR029063	S-adenosyl-L-methionine-dependent methyltransferase superfamily
MZ334504.1_orf1620	290f29a5d87dbd6961b38ba6c8c7cede	1304	PRINTS	PR00507	N12 class N6 adenine-specific DNA methyltransferase signature	425	441	5.9E-13	T	24-06-2023	-	-
MZ334504.1_orf1620	290f29a5d87dbd6961b38ba6c8c7cede	1304	PRINTS	PR00507	N12 class N6 adenine-specific DNA methyltransferase signature	709	721	5.9E-13	T	24-06-2023	-	-
MZ334504.1_orf1620	290f29a5d87dbd6961b38ba6c8c7cede	1304	PRINTS	PR00507	N12 class N6 adenine-specific DNA methyltransferase signature	452	466	5.9E-13	T	24-06-2023	-	-
MZ334504.1_orf1620	290f29a5d87dbd6961b38ba6c8c7cede	1304	SUPERFAMILY	SSF53335	S-adenosyl-L-methionine-dependent methyltransferases	273	836	1.27E-53	T	24-06-2023	IPR029063	S-adenosyl-L-methionine-dependent methyltransferase superfamily
MZ334504.1_orf1620	290f29a5d87dbd6961b38ba6c8c7cede	1304	PANTHER	PTHR33841	DNA METHYLTRANSFERASE YEEA-RELATED	401	1129	1.8E-58	T	24-06-2023	-	-
MZ334504.1_orf1620	290f29a5d87dbd6961b38ba6c8c7cede	1304	Pfam	PF13588	Type I restriction enzyme R protein N terminus (HSDR_N)	74	138	1.5E-6	T	24-06-2023	IPR029464	Type I restriction enzyme R protein, N-terminal domain
MZ334504.1_orf1620	290f29a5d87dbd6961b38ba6c8c7cede	1304	ProSitePatterns	PS00092	N-6 Adenine-specific DNA methylases signature.	712	718	-	T	24-06-2023	IPR002052	DNA methylase, N-6 adenine-specific, conserved site
MZ334504.1_orf1620	290f29a5d87dbd6961b38ba6c8c7cede	1304	Pfam	PF07669	Eco57I restriction-modification methylase	707	814	4.7E-12	T	24-06-2023	IPR011639	Type II restriction enzyme and methyltransferase RM.Eco57I-like
MZ334504.1_orf1620	290f29a5d87dbd6961b38ba6c8c7cede	1304	Gene3D	G3DSA:3.40.50.150	Vaccinia Virus protein VP39	405	575	7.8E-26	T	24-06-2023	IPR029063	S-adenosyl-L-methionine-dependent methyltransferase superfamily
MZ334504.1_orf1620	290f29a5d87dbd6961b38ba6c8c7cede	1304	Pfam	PF12950	TaqI-like C-terminal specificity domain	962	1128	3.7E-14	T	24-06-2023	IPR025931	TaqI-like C-terminal specificity domain
MZ334504.1_orf1620	290f29a5d87dbd6961b38ba6c8c7cede	1304	Pfam	PF02384	N-6 DNA Methylase	405	511	3.5E-9	T	24-06-2023	IPR003356	DNA methylase, adenine-specific
MZ334504.1_orf70	d6af6e6bb5a816139ceef7495b72cdaf	564	Pfam	PF17289	Terminase RNaseH-like domain	321	485	1.6E-6	T	24-06-2023	IPR035421	Terminase, large subunit gp17-like, C-terminal
MZ334504.1_orf70	d6af6e6bb5a816139ceef7495b72cdaf	564	Gene3D	G3DSA:3.40.50.300	-	6	223	2.0E-31	T	24-06-2023	IPR027417	P-loop containing nucleoside triphosphate hydrolase
MZ334504.1_orf70	d6af6e6bb5a816139ceef7495b72cdaf	564	Pfam	PF03237	Terminase large subunit, T4likevirus-type, N-terminal	72	293	4.3E-7	T	24-06-2023	-	-
MZ334504.1_orf70	d6af6e6bb5a816139ceef7495b72cdaf	564	MobiDBLite	mobidb-lite	consensus disorder prediction	489	564	-	T	24-06-2023	-	-
MZ334504.1_orf70	d6af6e6bb5a816139ceef7495b72cdaf	564	MobiDBLite	mobidb-lite	consensus disorder prediction	546	564	-	T	24-06-2023	-	-
MZ334504.1_orf70	d6af6e6bb5a816139ceef7495b72cdaf	564	Gene3D	G3DSA:3.30.420.240	-	295	488	3.7E-25	T	24-06-2023	-	-
MZ334504.1_orf228	12642cf03ff049fd7f61ebd43724f142	607	MobiDBLite	mobidb-lite	consensus disorder prediction	78	105	-	T	24-06-2023	-	-
MZ334504.1_orf228	12642cf03ff049fd7f61ebd43724f142	607	MobiDBLite	mobidb-lite	consensus disorder prediction	548	581	-	T	24-06-2023	-	-
MZ334504.1_orf228	12642cf03ff049fd7f61ebd43724f142	607	MobiDBLite	mobidb-lite	consensus disorder prediction	544	581	-	T	24-06-2023	-	-
MZ334504.1_orf316	f971d175d0e814bec20990f10deb5c3e	564	SUPERFAMILY	SSF49899	Concanavalin A-like lectins/glucanases	195	384	2.33E-9	T	24-06-2023	IPR013320	Concanavalin A-like lectin/glucanase domain superfamily
MZ334504.1_orf157	36bafd3aaf43f5235f1ee655a9a266e2	1040	MobiDBLite	mobidb-lite	consensus disorder prediction	118	160	-	T	24-06-2023	-	-
MZ334504.1_orf157	36bafd3aaf43f5235f1ee655a9a266e2	1040	MobiDBLite	mobidb-lite	consensus disorder prediction	135	154	-	T	24-06-2023	-	-
MZ334504.1_orf387	76215c167d931fb24fac84e93be0e84d	818	TIGRFAM	TIGR02504	NrdJ_Z: ribonucleoside-diphosphate reductase, adenosylcobalamin-dependent	50	742	6.6E-216	T	24-06-2023	IPR013344	Ribonucleotide reductase, adenosylcobalamin-dependent
MZ334504.1_orf387	76215c167d931fb24fac84e93be0e84d	818	Pfam	PF00317	Ribonucleotide reductase, all-alpha domain	44	120	6.9E-23	T	24-06-2023	IPR013509	Ribonucleotide reductase large subunit, N-terminal
MZ334504.1_orf387	76215c167d931fb24fac84e93be0e84d	818	PANTHER	PTHR43371	VITAMIN B12-DEPENDENT RIBONUCLEOTIDE REDUCTASE	12	817	7.0E-191	T	24-06-2023	-	-
MZ334504.1_orf387	76215c167d931fb24fac84e93be0e84d	818	Gene3D	G3DSA:3.20.70.20	-	34	274	1.3E-72	T	24-06-2023	-	-
MZ334504.1_orf387	76215c167d931fb24fac84e93be0e84d	818	Coils	Coil	Coil	629	649	-	T	24-06-2023	-	-
MZ334504.1_orf387	76215c167d931fb24fac84e93be0e84d	818	SUPERFAMILY	SSF51998	PFL-like glycyl radical enzymes	124	736	1.5E-119	T	24-06-2023	-	-
MZ334504.1_orf387	76215c167d931fb24fac84e93be0e84d	818	Pfam	PF02867	Ribonucleotide reductase, barrel domain	125	720	3.8E-129	T	24-06-2023	IPR000788	Ribonucleotide reductase large subunit, C-terminal
MZ334504.1_orf387	76215c167d931fb24fac84e93be0e84d	818	Gene3D	G3DSA:3.20.70.20	-	289	748	2.1E-102	T	24-06-2023	-	-
MZ334504.1_orf387	76215c167d931fb24fac84e93be0e84d	818	CDD	cd02888	RNR_II_dimer	97	735	7.3729E-170	T	24-06-2023	IPR013344	Ribonucleotide reductase, adenosylcobalamin-dependent
MZ334504.1_orf387	76215c167d931fb24fac84e93be0e84d	818	PRINTS	PR01183	Ribonucleotide reductase large chain signature	200	219	1.2E-20	T	24-06-2023	IPR000788	Ribonucleotide reductase large subunit, C-terminal
MZ334504.1_orf387	76215c167d931fb24fac84e93be0e84d	818	PRINTS	PR01183	Ribonucleotide reductase large chain signature	571	598	1.2E-20	T	24-06-2023	IPR000788	Ribonucleotide reductase large subunit, C-terminal
MZ334504.1_orf387	76215c167d931fb24fac84e93be0e84d	818	PRINTS	PR01183	Ribonucleotide reductase large chain signature	380	391	1.2E-20	T	24-06-2023	IPR000788	Ribonucleotide reductase large subunit, C-terminal
MZ334504.1_orf387	76215c167d931fb24fac84e93be0e84d	818	PRINTS	PR01183	Ribonucleotide reductase large chain signature	483	505	1.2E-20	T	24-06-2023	IPR000788	Ribonucleotide reductase large subunit, C-terminal
MZ334504.1_orf387	76215c167d931fb24fac84e93be0e84d	818	PRINTS	PR01183	Ribonucleotide reductase large chain signature	445	468	1.2E-20	T	24-06-2023	IPR000788	Ribonucleotide reductase large subunit, C-terminal
MZ334504.1_orf387	76215c167d931fb24fac84e93be0e84d	818	SUPERFAMILY	SSF48168	R1 subunit of ribonucleotide reductase, N-terminal domain	52	123	1.46E-9	T	24-06-2023	IPR008926	Ribonucleotide reductase R1 subunit, N-terminal
MZ334504.1_orf1482	047cc9a8b403ba9e586b94e7a7adabd6	864	Gene3D	G3DSA:3.30.420.10	-	152	365	3.4E-37	T	24-06-2023	IPR036397	Ribonuclease H superfamily
MZ334504.1_orf1482	047cc9a8b403ba9e586b94e7a7adabd6	864	Gene3D	G3DSA:3.90.1600.10	Palm domain of DNA polymerase	413	689	3.8E-38	T	24-06-2023	IPR023211	DNA polymerase, palm domain superfamily
MZ334504.1_orf1482	047cc9a8b403ba9e586b94e7a7adabd6	864	Gene3D	G3DSA:1.10.132.60	-	690	864	8.2E-13	T	24-06-2023	IPR042087	DNA polymerase family B, thumb domain
MZ334504.1_orf1482	047cc9a8b403ba9e586b94e7a7adabd6	864	Gene3D	G3DSA:3.30.342.10	DNA Polymerase, chain B, domain 1	16	137	6.1E-10	T	24-06-2023	-	-
MZ334504.1_orf1482	047cc9a8b403ba9e586b94e7a7adabd6	864	Pfam	PF00136	DNA polymerase family B	390	728	1.4E-26	T	24-06-2023	IPR006134	DNA-directed DNA polymerase, family B, multifunctional domain
MZ334504.1_orf1482	047cc9a8b403ba9e586b94e7a7adabd6	864	PANTHER	PTHR10322	DNA POLYMERASE CATALYTIC SUBUNIT	24	756	7.1E-62	T	24-06-2023	-	-
MZ334504.1_orf1482	047cc9a8b403ba9e586b94e7a7adabd6	864	SMART	SM00486	polmehr3	149	603	2.0E-45	T	24-06-2023	IPR006172	DNA-directed DNA polymerase, family B
MZ334504.1_orf1482	047cc9a8b403ba9e586b94e7a7adabd6	864	ProSitePatterns	PS00018	EF-hand calcium-binding domain.	76	88	-	T	24-06-2023	IPR018247	EF-Hand 1, calcium-binding site
MZ334504.1_orf1482	047cc9a8b403ba9e586b94e7a7adabd6	864	PRINTS	PR00106	DNA-directed DNA-polymerase family B signature	589	597	4.5E-5	T	24-06-2023	IPR006172	DNA-directed DNA polymerase, family B
MZ334504.1_orf1482	047cc9a8b403ba9e586b94e7a7adabd6	864	PRINTS	PR00106	DNA-directed DNA-polymerase family B signature	435	448	4.5E-5	T	24-06-2023	IPR006172	DNA-directed DNA polymerase, family B
MZ334504.1_orf1482	047cc9a8b403ba9e586b94e7a7adabd6	864	PRINTS	PR00106	DNA-directed DNA-polymerase family B signature	536	548	4.5E-5	T	24-06-2023	IPR006172	DNA-directed DNA polymerase, family B
MZ334504.1_orf1482	047cc9a8b403ba9e586b94e7a7adabd6	864	SUPERFAMILY	SSF56672	DNA/RNA polymerases	406	858	4.39E-72	T	24-06-2023	IPR043502	DNA/RNA polymerase superfamily
MZ334504.1_orf1482	047cc9a8b403ba9e586b94e7a7adabd6	864	SUPERFAMILY	SSF53098	Ribonuclease H-like	13	385	1.52E-57	T	24-06-2023	IPR012337	Ribonuclease H-like superfamily
MZ334504.1_orf1482	047cc9a8b403ba9e586b94e7a7adabd6	864	Pfam	PF03104	DNA polymerase family B, exonuclease domain	84	273	8.6E-21	T	24-06-2023	IPR006133	DNA-directed DNA polymerase, family B, exonuclease domain
MZ334504.1_orf1189	cf1e3bfad79e57f26f488a14e5a1b75a	599	Gene3D	G3DSA:3.40.50.300	-	400	584	6.4E-19	T	24-06-2023	IPR027417	P-loop containing nucleoside triphosphate hydrolase
MZ334504.1_orf1189	cf1e3bfad79e57f26f488a14e5a1b75a	599	Gene3D	G3DSA:3.40.50.300	-	41	254	3.9E-7	T	24-06-2023	IPR027417	P-loop containing nucleoside triphosphate hydrolase
MZ334504.1_orf1189	cf1e3bfad79e57f26f488a14e5a1b75a	599	PANTHER	PTHR11472	DNA REPAIR DEAD HELICASE RAD3/XP-D SUBFAMILY MEMBER	417	583	6.1E-14	T	24-06-2023	IPR045028	Helicase superfamily 1/2, DinG/Rad3-like
MZ334504.1_orf1189	cf1e3bfad79e57f26f488a14e5a1b75a	599	SMART	SM00491	Cxpdneu3	445	567	1.8E-9	T	24-06-2023	IPR006555	ATP-dependent helicase, C-terminal
MZ334504.1_orf1189	cf1e3bfad79e57f26f488a14e5a1b75a	599	Pfam	PF13307	Helicase C-terminal domain	436	580	6.7E-17	T	24-06-2023	IPR006555	ATP-dependent helicase, C-terminal
MZ334504.1_orf1189	cf1e3bfad79e57f26f488a14e5a1b75a	599	Pfam	PF04851	Type III restriction enzyme, res subunit	43	234	4.0E-6	T	24-06-2023	IPR006935	Helicase/UvrB, N-terminal
MZ334504.1_orf1189	cf1e3bfad79e57f26f488a14e5a1b75a	599	SUPERFAMILY	SSF52540	P-loop containing nucleoside triphosphate hydrolases	424	564	9.35E-15	T	24-06-2023	IPR027417	P-loop containing nucleoside triphosphate hydrolase
MZ334504.1_orf1189	cf1e3bfad79e57f26f488a14e5a1b75a	599	SUPERFAMILY	SSF52540	P-loop containing nucleoside triphosphate hydrolases	27	231	4.65E-8	T	24-06-2023	IPR027417	P-loop containing nucleoside triphosphate hydrolase
