	fasta	scaffold	gene_position	start_position	end_position	strandedness	rank	viral_id	viral_hit	viral_RBH	viral_identity	viral_bitScore	viral_eVal	pfam_hits	vogdb_id	vogdb_hits	vogdb_categories	heme_regulatory_motif_count	is_transposon	amg_flags
QGNH01000428.1_1	QGNH01000428.1	QGNH01000428.1	1	3	1091	-1	D	YP_007674373.1	YP_007674373.1 hypothetical protein SWZG_00008 [Synechococcus phage S-SKS1]	False	0.305	110	1.68e-24	Concanavalin A-like lectin/glucanases superfamily [PF13385.9]				0	False	MKF
QGNH01000428.1_2	QGNH01000428.1	QGNH01000428.1	2	1094	2254	-1	E	YP_009226553.1	YP_009226553.1 hypothetical protein AXI85_gp49 [Ralstonia phage RS138]	False	0.294	168	2.355e-43		VOG04103	REFSEQ tail assembly protein; Xu	Xu	0	False	F
QGNH01000428.1_3	QGNH01000428.1	QGNH01000428.1	3	2296	6078	-1	E	YP_009226552.1	YP_009226552.1 Tai fiber [Ralstonia phage RS138]	True	0.333	661	2.7600000000000004e-199		VOG27862	REFSEQ putative tail protein b; Xu	Xu	0	False	F
QGNH01000428.1_4	QGNH01000428.1	QGNH01000428.1	4	6124	6531	-1	E	YP_009226551.1	YP_009226551.1 hypothetical protein AXI85_gp47 [Ralstonia phage RS138]	False	0.479	121	3.0820000000000003e-31		VOG02433	REFSEQ hypothetical protein; Xu	Xu	0	False	F
QGNH01000428.1_5	QGNH01000428.1	QGNH01000428.1	5	6545	10282	-1	D	YP_002274275.1	YP_002274275.1 tail tape measure protein [Stx2-converting phage 1717]	False	0.439	174	3.2460000000000004e-42	Tape measure protein [PF20155.2]	VOG02145	REFSEQ tail length tape measure protein; Xu	Xu	0	False	F
