	fasta	scaffold	gene_position	start_position	end_position	strandedness	rank	ko_id	kegg_hit	viral_id	viral_hit	viral_RBH	viral_identity	viral_bitScore	viral_eVal	peptidase_id	peptidase_family	peptidase_hit	peptidase_RBH	peptidase_bitScore	peptidase_eVal	peptidase_identity	pfam_hits	vogdb_id	vogdb_hits	vogdb_categories	heme_regulatory_motif_count	is_transposon	amg_flags
QGNH01001037.1_1	QGNH01001037.1	QGNH01001037.1	1	3	4232	-1	C	K02346	DNA polymerase IV [EC:2.7.7.7]	YP_009207149.1	YP_009207149.1 DNA polymerase [Streptomyces phage Caliburn]	True	0.281	415.0	1.125e-116								Bacterial DNA polymerase III alpha NTPase domain [PF07733.15]; Bacterial DNA polymerase III alpha subunit finger domain [PF17657.4]; impB/mucB/samB family [PF00817.23]; impB/mucB/samB family C-terminal domain [PF11799.11]; Helix-hairpin-helix motif [PF14579.9]; PHP domain [PF02811.22]	VOG07446	sp|O67125|DPO3A_AQUAE DNA polymerase III subunit alpha; XhXr	Xh;Xr	0	False	VF
QGNH01001037.1_2	QGNH01001037.1	QGNH01001037.1	2	4236	4859	-1	C	K01356	repressor LexA [EC:3.4.21.88]	YP_007238155.1	YP_007238155.1 UmuD-like protein [Cronobacter phage ENT39118]	False	0.329	63.0	3.799e-10	MER1042737	S24	MER1042737 - family S24 unassigned peptidases (Pedosphaera parvula) [S24.UPW]#S24#{peptidase unit: 105-203}~source B9XRF1~	False	133.0	1.093e-33	0.663	Peptidase S24-like [PF00717.26]; LexA DNA binding domain [PF01726.19]	VOG03747	sp|P0AG11|UMUD_ECOLI Protein UmuD; Xh	Xh	0	False	PF
QGNH01001037.1_3	QGNH01001037.1	QGNH01001037.1	3	4973	5752	1	D																GIY-YIG catalytic domain [PF01541.27]				0	False	F
QGNH01001037.1_4	QGNH01001037.1	QGNH01001037.1	4	5761	5910	-1	E																				0	False	
QGNH01001037.1_5	QGNH01001037.1	QGNH01001037.1	5	5897	7810	-1	D			YP_009052380.1	YP_009052380.1 ABC transporter [Aureococcus anophagefferens virus]	False	0.286	102.0	6.202e-21								ABC transporter [PF00005.30]; ABC transporter transmembrane region [PF00664.26]	VOG06047	sp|G0SEV9|RLI1_CHATD Translation initiation factor RLI1; Xh	Xh	0	False	F
QGNH01001037.1_6	QGNH01001037.1	QGNH01001037.1	6	7807	9543	-1	D			NP_046572.1	NP_046572.1 ABC transporter [Bacillus phage SPBc2]	False	0.233	121.0	8.114e-27								ABC transporter [PF00005.30]; ABC transporter transmembrane region [PF00664.26]; RecF/RecN/SMC N terminal domain [PF02463.22]	VOG06047	sp|G0SEV9|RLI1_CHATD Translation initiation factor RLI1; Xh	Xh	0	False	F
QGNH01001037.1_7	QGNH01001037.1	QGNH01001037.1	7	9771	10712	-1	D																Protein of unknown function DUF72 [PF01904.21]	VOG16448	REFSEQ hypothetical protein; Xu	Xu	0	False	F
