	fasta	scaffold	gene_position	start_position	end_position	strandedness	rank	ko_id	kegg_hit	viral_id	viral_hit	viral_RBH	viral_identity	viral_bitScore	viral_eVal	pfam_hits	cazy_ids	cazy_hits	cazy_subfam_ec	cazy_best_hit	vogdb_id	vogdb_hits	vogdb_categories	heme_regulatory_motif_count	is_transposon	amg_flags
QGNH01001401.1_1	QGNH01001401.1	QGNH01001401.1	1	2	373	-1	E			YP_024897.1	YP_024897.1 gp62 [Burkholderia phage BcepB1A]	False	0.478	108.0	8.442e-27									0	False	F
QGNH01001401.1_2	QGNH01001401.1	QGNH01001401.1	2	363	713	-1	D			YP_008059923.1	YP_008059923.1 HNH endonuclease [Mycobacterium phage WIVsmall]	False	0.465	86.0	3.018e-19	HNH endonuclease [PF13392.9]; Zinc-binding loop region of homing endonuclease [PF05551.14]					VOG00678	REFSEQ HNH endonuclease; Xu	Xu	0	False	F
QGNH01001401.1_3	QGNH01001401.1	QGNH01001401.1	3	710	2350	-1	D			YP_007006398.1	YP_007006398.1 putative helicase [Vibrio phage vB_VchM-138]	True	0.414	423.0	2.149e-128	Helicase conserved C-terminal domain [PF00271.34]; Type III restriction enzyme, res subunit [PF04851.18]					VOG25107	REFSEQ DNA helicase; Xu	Xu	0	False	F
QGNH01001401.1_4	QGNH01001401.1	QGNH01001401.1	4	2471	3085	1	E																	0	False	F
QGNH01001401.1_5	QGNH01001401.1	QGNH01001401.1	5	3143	4225	1	D			YP_024901.1	YP_024901.1 exonuclease [Burkholderia phage BcepB1A]	False	0.311	167.0	2.121e-43	Protein of unknown function (DUF2800) [PF10926.11]					VOG00510	sp|O64262|VG69_BPMD2 Gene 69 protein; Xu	Xu	0	False	F
QGNH01001401.1_6	QGNH01001401.1	QGNH01001401.1	6	4222	4497	1	E																	0	False	F
QGNH01001401.1_7	QGNH01001401.1	QGNH01001401.1	7	4522	5424	1	E			YP_007006392.1	YP_007006392.1 Gp2.5-like ssDNA binding protein and ssDNA annealing protein [Vibrio phage vB_VchM-138]	False	0.418	159.0	1.672e-41						VOG00262	sp|P20313|SSB_BPT3 Single-stranded DNA-binding protein; Xr	Xr	0	False	VF
QGNH01001401.1_8	QGNH01001401.1	QGNH01001401.1	8	5550	7028	1	C	K02334	DNA polymerase bacteriophage-type [EC:2.7.7.7]	YP_010738866.1	YP_010738866.1 DNA polymerase I [Xanthomonas phage FMYAK-P1]	False	0.299	211.0	1.256e-56	DNA polymerase family A [PF00476.23]					VOG00693	sp|P06225|DPOL_BPSP2 DNA polymerase; XhXr	Xh;Xr	0	False	V
QGNH01001401.1_9	QGNH01001401.1	QGNH01001401.1	9	7033	7584	1	E			YP_010739243.1	YP_010739243.1 DNA polymerase I [Pseudomonas phage phiH2]	False	0.382	94.0	5.107e-21									0	False	
QGNH01001401.1_10	QGNH01001401.1	QGNH01001401.1	10	7581	8024	-1	D			YP_010053378.1	YP_010053378.1 tail assembly chaperone [Salmonella phage Segz_1]	False	0.333	63.0	1.073e-10	Protein of unknown function (DUF1353) [PF07087.14]					VOG00916	REFSEQ tail assembly chaperone; Xu	Xu	0	False	
QGNH01001401.1_11	QGNH01001401.1	QGNH01001401.1	11	8014	8760	-1	E																	0	False	
QGNH01001401.1_12	QGNH01001401.1	QGNH01001401.1	12	8798	9379	-1	C	K01185	lysozyme [EC:3.2.1.17]	YP_002284361.1	YP_002284361.1 endolysin [Pseudomonas phage PAJU2]	False	0.339	82.0	1.074e-16	Phage lysozyme [PF00959.22]	GH24	GH24 lysozyme (EC 3.2.1.17)	3.2.1.17	GH24.hmm				0	False	
QGNH01001401.1_13	QGNH01001401.1	QGNH01001401.1	13	9472	10812	-1	E			YP_001950060.1	YP_001950060.1 tail fiber protein [Ralstonia phage phiRSL1]	False	0.345	117.0	4.03e-26									0	False	
QGNH01001401.1_14	QGNH01001401.1	QGNH01001401.1	14	10825	12612	-1	D			YP_010052736.1	YP_010052736.1 structural protein [Ralstonia phage Adzire]	False	0.383	129.0	2.314e-29	Protein of unknown function (DUF2612) [PF11041.11]; PASTA domain [PF03793.22]; Concanavalin A-like lectin/glucanases superfamily [PF13385.9]								0	False	MK
QGNH01001401.1_15	QGNH01001401.1	QGNH01001401.1	15	12612	14084	-1	D			YP_010052735.1	YP_010052735.1 hypothetical protein KE332_gp44 [Ralstonia phage Adzire]	False	0.338	265.0	4.489e-75	Baseplate J-like protein [PF04865.17]					VOG00521	sp|P51767|BPJ_BPP2 Baseplate protein J; XhXs	Xs;Xh	0	False	V
QGNH01001401.1_16	QGNH01001401.1	QGNH01001401.1	16	14086	14454	-1	E			YP_010052839.1	YP_010052839.1 baseplate wedge subunit [Edwardsiella phage Edno5]	False	0.372	76.0	1.029e-15									0	False	
QGNH01001401.1_17	QGNH01001401.1	QGNH01001401.1	17	14451	14876	-1	D			YP_010052734.1	YP_010052734.1 hypothetical protein KE332_gp43 [Ralstonia phage Adzire]	False	0.323	75.0	5.394e-15	Phage protein Gp138 N-terminal domain [PF18352.4]; GpV Apex motif [PF18946.3]					VOG00324	sp|P31340|SPIKE_BPP2 Spike protein; XhXpXs	Xs;Xp;Xh	0	False	V
QGNH01001401.1_18	QGNH01001401.1	QGNH01001401.1	18	14882	15127	-1	E																	0	False	
QGNH01001401.1_19	QGNH01001401.1	QGNH01001401.1	19	15127	16056	-1	E			YP_010053039.1	YP_010053039.1 baseplate hub [Aeromonas phage 4_D05]	False	0.273	113.0	9.189e-26						VOG01442	REFSEQ baseplate hub; Xu	Xu	0	False	
QGNH01001401.1_20	QGNH01001401.1	QGNH01001401.1	20	16046	16423	-1	E			YP_010052836.1	YP_010052836.1 virion structural protein [Edwardsiella phage Edno5]	False	0.316	61.0	1.799e-10						VOG00258	REFSEQ virion structural protein; Xu	Xu	0	False	
QGNH01001401.1_21	QGNH01001401.1	QGNH01001401.1	21	16426	17157	-1	E			YP_009613848.1	YP_009613848.1 AB1gp83 [Acinetobacter phage AB1]	False	0.334	72.0	1.032e-12						VOG01485	REFSEQ tail fiber protein; Xu	Xu	0	False	
QGNH01001401.1_22	QGNH01001401.1	QGNH01001401.1	22	17154	18698	-1	E			YP_010053034.1	YP_010053034.1 tail length tape measure protein [Aeromonas phage 4_D05]	False	0.166	73.0	4.994e-12									0	False	
QGNH01001401.1_23	QGNH01001401.1	QGNH01001401.1	23	18898	19338	-1	E														VOG10987	REFSEQ tail assembly chaperone; Xu	Xu	0	False	
QGNH01001401.1_24	QGNH01001401.1	QGNH01001401.1	24	19379	19813	-1	E			YP_010052955.1	YP_010052955.1 virion structural protein [Aeromonas phage 2_D05]	False	0.387	93.0	4.371e-21						VOG02012	REFSEQ tail fiber protein; Xu	Xu	0	False	
QGNH01001401.1_25	QGNH01001401.1	QGNH01001401.1	25	19825	20340	-1	D			YP_010052640.1	YP_010052640.1 tail sheath [Xanthomonas virus phiXaf18]	False	0.381	113.0	1.351e-27	Protein of unknown function (DUF3383) [PF11863.11]								0	False	
QGNH01001401.1_26	QGNH01001401.1	QGNH01001401.1	26	20324	21553	-1	D			YP_007007754.1	YP_007007754.1 tail sheath [Aeromonas phage vB_AsaM-56]	False	0.375	113.0	4.547e-25	Protein of unknown function (DUF3383) [PF11863.11]					VOG03778	REFSEQ tail sheath; Xu	Xu	0	False	
QGNH01001401.1_27	QGNH01001401.1	QGNH01001401.1	27	21595	22161	-1	E			YP_007007753.1	YP_007007753.1 hypothetical protein F394_gp64 [Aeromonas phage vB_AsaM-56]	False	0.337	86.0	4.152e-18						VOG01549	REFSEQ hypothetical protein; Xu	Xu	0	False	
QGNH01001401.1_28	QGNH01001401.1	QGNH01001401.1	28	22158	22559	-1	E			YP_009126615.1	YP_009126615.1 head protein [Edwardsiella phage GF-2]	False	0.338	75.0	2.941e-15						VOG04390	REFSEQ head protein; Xu	Xu	0	False	
QGNH01001401.1_29	QGNH01001401.1	QGNH01001401.1	29	22556	23065	-1	E			YP_010052951.1	YP_010052951.1 tail completion or Neck1 protein [Aeromonas phage 2_D05]	False	0.407	116.0	7.408e-29						VOG02678	REFSEQ tail completion or Neck1 protein; Xu	Xu	0	False	
QGNH01001401.1_30	QGNH01001401.1	QGNH01001401.1	30	23058	23858	-1	E			YP_453623.1	YP_453623.1 virion structural protein [Xanthomonas phage OP2]	False	0.22	60.0	1.098e-08						VOG00732	REFSEQ virion structural protein; Xu	Xu	0	False	
QGNH01001401.1_31	QGNH01001401.1	QGNH01001401.1	31	23862	24308	-1	E																	0	False	
QGNH01001401.1_32	QGNH01001401.1	QGNH01001401.1	32	24321	24881	-1	E																	0	False	F
QGNH01001401.1_33	QGNH01001401.1	QGNH01001401.1	33	24900	25934	-1	D			YP_010052945.1	YP_010052945.1 hypothetical protein KE335_gp58 [Aeromonas phage 2_D05]	False	0.482	307.0	1.123e-91	Uncharacterized protein conserved in bacteria (DUF2184) [PF09950.12]					VOG02112	sp|A0A0U5AF03|CAPSD_BPK22 Major capsid protein; Xs	Xs	0	False	VF
QGNH01001401.1_34	QGNH01001401.1	QGNH01001401.1	34	25958	26887	-1	E			YP_010052944.1	YP_010052944.1 minor head protein [Aeromonas phage 2_D05]	False	0.436	105.0	2.926e-23						VOG04729	REFSEQ virion structural protein; Xu	Xu	0	False	F
QGNH01001401.1_35	QGNH01001401.1	QGNH01001401.1	35	26918	27553	-1	E																	0	False	F
QGNH01001401.1_36	QGNH01001401.1	QGNH01001401.1	36	27589	28203	-1	C	K09960	uncharacterized protein	YP_010052943.1	YP_010052943.1 head maturation protease [Aeromonas phage 2_D05]	False	0.54	183.0	3.493e-51	Uncharacterized protein conserved in bacteria (DUF2213) [PF09979.12]					VOG02460	sp|P44180|Y1405_HAEIN Uncharacterized protein HI_1405; Xu	Xu	0	False	F
QGNH01001401.1_37	QGNH01001401.1	QGNH01001401.1	37	28191	29399	-1	E																	0	False	F
